{
  "command": "continue",
  "protocolVersion": "1",
  "runId": "123e4567-e89b-12d3-a456-426614174000",
  "eventId": "223e4567-e89b-12d3-a456-426614174001",
  "revision": 1,
  "kind": "actions",
  "results": [
    {
      "id": "act_0",
      "ok": true
    },
    {
      "id": "act_1",
      "ok": true
    },
    {
      "id": "act_2",
      "ok": true
    },
    {
      "id": "act_3",
      "ok": true
    },
    {
      "id": "act_4",
      "ok": true
    },
    {
      "id": "act_5",
      "ok": true
    },
    {
      "id": "act_6",
      "ok": true
    },
    {
      "id": "act_7",
      "ok": true
    },
    {
      "id": "act_8",
      "ok": true
    },
    {
      "id": "act_9",
      "ok": true
    },
    {
      "id": "act_10",
      "ok": true
    },
    {
      "id": "act_11",
      "ok": true
    }
  ]
}
