{
  "command": "continue",
  "protocolVersion": "1",
  "runId": "123e4567-e89b-12d3-a456-426614174000",
  "eventId": "223e4567-e89b-12d3-a456-426614174001",
  "revision": 1,
  "kind": "actions",
  "results": [
    {
      "id": "act_nav",
      "ok": true
    }
  ],
  "context": {
    "page": "checkout",
    "values": {
      "zip": "94105"
    },
    "availableTargets": [
      "checkout.submit"
    ]
  }
}
